<?xml version="1.0" encoding="UTF-8"?>
<!-- <!DOCTYPE zones SYSTEM "zones.dtd"> -->
<zones>
 <!--
   ** Load zones. Written from left to right and from top to bottom.
   ** Please respect it!
   -->


 <!--  Level 6 -->


 <!--  Level 5 -->


 <!--  Level 4 -->


 <!--  Level 3 -->


 <!--  Level 2 -->


 <!--  Level 1 -->


 <!--  Ground level -->

 <zone name="0_kalavan_castle" level="0" x="499616" y="500640" file="Level 0/kalavan/castle.tmx">
  <portal x="63" y="72" ref="castle_entrance_left">
   <destination zone="int_kalavan_castle" ref="entrance_left"/>
  </portal>
  <portal x="64" y="72" ref="castle_entrance_right">
   <destination zone="int_kalavan_castle" ref="entrance_right"/>
  </portal>
  <portal x="63" y="48" ref="castle_2_entrance_left">
   <destination zone="int_kalavan_castle_2" ref="entrance_left"/>
  </portal>
  <portal x="64" y="48" ref="castle_2_entrance_right">
   <destination zone="int_kalavan_castle_2" ref="entrance_right"/>
  </portal>
 </zone>

 <zone name="int_kalavan_castle_basement" file="interiors/kalavan/castle_basement.tmx">
  <portal x="31" y="39" ref="upstairs">
   <destination zone="int_kalavan_castle" ref="downstairs"/>
  </portal>
 </zone>

 <zone name="int_kalavan_castle" file="interiors/kalavan/castle.tmx">
  <portal x="31" y="63" ref="entrance_left">
   <destination zone="0_kalavan_castle" ref="castle_entrance_left"/>
  </portal>
  <portal x="32" y="63" ref="entrance_right">
   <destination zone="0_kalavan_castle" ref="castle_entrance_right"/>
  </portal>
  <portal x="31" y="39" ref="upstairs">
   <destination zone="int_kalavan_castle_1" ref="downstairs"/>
  </portal>
  <portal x="32" y="39" ref="downstairs">
   <destination zone="int_kalavan_castle_basement" ref="upstairs"/>
  </portal>
 </zone>

 <zone name="int_kalavan_castle_1" file="interiors/kalavan/castle_1.tmx">
  <portal x="31" y="36" ref="downstairs">
   <destination zone="int_kalavan_castle_0" ref="upstairs"/>
  </portal>
  <portal x="32" y="36" ref="upstairs">
   <destination zone="int_kalavan_castle_2" ref="downstairs"/>
  </portal>
 </zone>

 <zone name="int_kalavan_castle_2" file="interiors/kalavan/castle_2.tmx">
  <portal x="15" y="15" ref="entrance_left">
   <destination zone="0_kalavan_castle" ref="castle_2_entrance_left"/>
  </portal>
  <portal x="16" y="15" ref="entrance_right">
   <destination zone="0_kalavan_castle" ref="castle_2_entrance_right"/>
  </portal>
  <portal x="16" y="10" ref="downstairs">
   <destination zone="int_kalavan_castle_1" ref="upstairs"/>
  </portal>
 </zone>

 <zone name="0_kalavan_city" level="0" x="499616" y="500768" file="Level 0/kalavan/city.tmx">
  <entity x="63" y="10">
   <implementation class-name="games.stendhal.server.entity.Sign"/>
   <attribute name="text">Friends, welcome to Kalavan City.</attribute>
   <attribute name="class">transparent</attribute>
  </entity>
  <entity x="64" y="10">
   <implementation class-name="games.stendhal.server.entity.Sign"/>
   <attribute name="text">Enemies, beware!</attribute>
   <attribute name="class">transparent</attribute>
  </entity>
  <entity x="65" y="10">
   <implementation class-name="games.stendhal.server.entity.Sign"/>
   <attribute name="text">Kalavan City, twinned with Deniran.</attribute>
   <attribute name="class">transparent</attribute>
  </entity>
  <entity x="3" y="29">
   <implementation class-name="games.stendhal.server.entity.WalkBlocker"/>
   <attribute name="description">You see a hot grill, for fish, meat or ham.</attribute>
  </entity>
  <entity x="3" y="30">
   <implementation class-name="games.stendhal.server.entity.WalkBlocker"/>
   <attribute name="description">You see a barbecue, and wonder where the cook is.</attribute>
  </entity>
  <entity x="123" y="13">
   <implementation class-name="games.stendhal.server.entity.WalkBlocker"/>
   <attribute name="description">You see a barbecue, ready to grill some fish. Careful, it will be hot!</attribute>
  </entity>
  <entity x="123" y="14">
   <implementation class-name="games.stendhal.server.entity.WalkBlocker"/>
   <attribute name="description">You see a barbecue for grilling meat. Just try not to burn it.</attribute>
  </entity>
  <entity x="114" y="44">
   <implementation class-name="games.stendhal.server.entity.Sign"/>
   <attribute name="text">Dear Mr Postman, please leave my mail under the mat, as birds are nesting in this mailbox.</attribute>
   <attribute name="class">transparent</attribute>
  </entity>
  <entity x="57" y="125">
   <implementation class-name="games.stendhal.server.entity.WalkBlocker"/>
   <attribute name="description">You see a grill, looks like someone is going to barbecue soon.</attribute>
  </entity>
  <entity x="58" y="125">
   <implementation class-name="games.stendhal.server.entity.WalkBlocker"/>
   <attribute name="description">You see a barbecue, ready to grill some ham. Careful, it's very hot!</attribute>
  </entity>
 </zone>


 <!--  Level -1 -->


 <!--  Level -2 -->


 <!--  Level -3 -->


 <!--  Level -4 -->


 <!--  Level -5 -->


 <!--  Level -6 -->


 <!--  Level -7 -->

</zones>
