<?xml version="1.0" encoding="UTF-8"?>
<!-- <!DOCTYPE zones SYSTEM "zones.dtd"> -->
<zones>
 <!--
   ** Load zones. Written from left to right and from top to bottom.
   ** Please respect it!
   -->

 <!-- Level 6 -->

 <zone name="6_kikareukin_islands" level="6" x="499616" y="499744" file="Level 6/kikareukin/islands.tmx">
  <portal x="66" y="63" ref="exit">
   <destination zone="0_semos_mountain_n_w4" ref="kikareukin_exit"/>
  </portal>
 </zone>


 <!-- Level 5 -->

 <zone name="5_kikareukin_cave" level="5" x="499616" y="499744" file="Level 5/kikareukin/cave.tmx">
 </zone>


 <!-- Level 4 -->

 <zone name="4_kikareukin_cave" level="4" x="499616" y="499744" file="Level 4/kikareukin/cave.tmx">
 </zone>


 <!-- Level 3 -->

 <zone name="3_kikareukin_cave" level="3" x="499616" y="499744" file="Level 3/kikareukin/cave.tmx">
 </zone>


 <!-- Level 2 -->

 <zone name="2_kikareukin_cave" level="2" x="499616" y="499744" file="Level 2/kikareukin/cave.tmx">
 </zone>


 <!-- Level 1 -->

 <zone name="1_kikareukin_cave" level="1" x="499616" y="499744" file="Level 1/kikareukin/cave.tmx">
  <portal x="16" y="96" ref="entrance">
   <destination zone="0_semos_mountain_n_w4" ref="kikareukin_entrance"/>
  </portal>
 </zone>


 <!-- Level 0 (Ground) -->


 <!-- Level -1 -->


 <!-- Level -2 -->


 <!-- Level -3 -->


 <!-- Level -4 -->


 <!-- Level -5 -->


 <!-- Level -6 -->


 <!-- Level -7 -->

</zones>
